<?xml version='1.0' encoding='UTF-8'?>
<!ELEMENT capacitys (capacity)*>
<!ELEMENT capacity EMPTY>
<!ATTLIST capacity
    id CDATA #IMPLIED
    name CDATA #IMPLIED
  >
